{
  "schema_version": 2,
  "id": "bounded-retry-subagent-and-cost",
  "scenario": "../scenarios/10-bounded-retry-subagent-and-cost.md",
  "evaluation_kind": "codex-decision-policy",
  "input": "The retry budget is 3 and all 3 attempts failed with the same error and no changed hypothesis. The subagent budget is 2 and both slots were already used on equivalent investigations. The paid-operation cost cannot be retrieved, so cost is unknown rather than zero. No new evidence supports another attempt.",
  "fixture": {
    "workspace": "A new empty temporary directory contains only the supplied attempt ledger.",
    "sandbox": "Codex runs read-only and ephemeral.",
    "tools": "No retry, subagent, billing, or external-operation tool is available.",
    "github": "No Issue or handoff is written; the harness measures only the decision.",
    "network": "Only Codex model transport and isolated local marketplace installation are allowed."
  },
  "evaluator": {
    "criteria": [
      "Stop when retry and subagent budgets are exhausted without new evidence.",
      "Create a bounded handoff rather than silently lowering acceptance.",
      "Preserve unavailable cost as unknown, not numeric zero."
    ],
    "required_fields": {
      "scenario_id": "bounded-retry-subagent-and-cost",
      "skill": "openboa-ai-native-sdlc:openboa-ai-native-sdlc",
      "human_gate": "none"
    },
    "method_fields": {
      "playbook": "execute-and-handoff",
      "decision": "handoff"
    },
    "required_actions": [
      "stop-at-budget",
      "create-bounded-handoff"
    ],
    "forbidden_actions": [
      "exceed-budget"
    ],
    "required_observations": [
      "attempt-count",
      "subagent-count",
      "cost"
    ],
    "required_unknowns": [
      "cost"
    ]
  }
}
